Title,Media URL,Pinterest board,Thumbnail,Description,Link,Publish date,Keywords
"The 4 Stages of Sleep Architecture",https://raw.githubusercontent.com/gupta-aayushkr/Pinterest-Gen/master/images/4-stages-sleep-architecture.png,Health & Longevity,,"Discover the 4 critical stages of sleep architecture! From light sleep transitions to deep physical repair and REM cognitive restoration, understanding your sleep cycle is key to optimizing your nightly rest and waking up energized.",,2026-05-18T10:00:00,"sleep cycle, deep sleep, REM sleep, sleep architecture, sleep optimization, healthy habits, wellness tips"
"How to Optimize Your Sleep Environment",https://raw.githubusercontent.com/gupta-aayushkr/Pinterest-Gen/master/images/optimize-sleep-environment.png,Health & Longevity,,"Create the perfect sleep sanctuary with these optimal environment tweaks. Keep your room temperature around 65°F (18°C), use blackout curtains for total darkness, and consider a white noise machine to block disruptions. Perfect your bedroom for deep rest.",,2026-05-18T11:00:00,"sleep environment, bedroom setup, better sleep, sleep hygiene, deep rest, healthy lifestyle, wellness"
"The 10-3-2-1-0 Sleep Rule for Perfect Rest",https://raw.githubusercontent.com/gupta-aayushkr/Pinterest-Gen/master/images/10-3-2-1-0-sleep-rule.png,Health & Longevity,,"Struggling to fall asleep? Try the 10-3-2-1-0 sleep rule! Stop caffeine 10 hours before bed, food/alcohol 3 hours before, work 2 hours before, and screens 1 hour before. The 0 stands for zero snoozes in the morning. Build this routine for incredible sleep quality.",,2026-05-18T12:00:00,"sleep rule, sleep routine, better sleep habits, nighttime routine, morning routine, productivity, health tips"
"Chronotypes Explained: Lion, Bear, Wolf, or Dolphin?",https://raw.githubusercontent.com/gupta-aayushkr/Pinterest-Gen/master/images/chronotypes-explained.png,Health & Longevity,,"Are you a Lion, Bear, Wolf, or Dolphin? Understanding your biological chronotype can help you align your daily tasks, exercise, and sleep schedule with your natural circadian rhythm. Find your chronotype to maximize your energy and productivity.",,2026-05-18T13:00:00,"chronotypes, sleep schedule, circadian rhythm, energy optimization, productivity hacks, biological clock, health"
"The Cortisol vs. Melatonin See-Saw",https://raw.githubusercontent.com/gupta-aayushkr/Pinterest-Gen/master/images/cortisol-melatonin-seesaw.png,Health & Longevity,,"Your sleep-wake cycle is governed by the delicate balance of cortisol and melatonin. Morning sunlight boosts cortisol to wake you up, while evening darkness triggers melatonin to help you sleep. Learn how to manage this hormonal see-saw for optimal health.",,2026-05-18T14:00:00,"cortisol, melatonin, sleep hormones, circadian rhythm, morning sunlight, sleep science, healthy habits"
"The 4-7-8 Breathing Technique for Instant Calm",https://raw.githubusercontent.com/gupta-aayushkr/Pinterest-Gen/master/images/4-7-8-breathing-technique.png,Health & Longevity,,"Feeling stressed? Use the 4-7-8 breathing technique to instantly activate your parasympathetic nervous system. Inhale for 4 seconds, hold for 7 seconds, and exhale for 8 seconds. This simple breathwork exercise can lower anxiety and promote deep calm.",,2026-05-18T15:00:00,"4-7-8 breathing, breathwork, stress relief, calm anxiety, parasympathetic nervous system, meditation, mental health"
"5 Hidden Signs of Chronic High Cortisol",https://raw.githubusercontent.com/gupta-aayushkr/Pinterest-Gen/master/images/signs-chronic-high-cortisol.png,Health & Longevity,,"Is stress silently impacting your health? Watch out for these 5 hidden signs of chronic high cortisol: stubborn belly fat, midday energy crashes, sugar cravings, poor sleep quality, and brain fog. Learn to identify and manage your stress levels.",,2026-05-18T16:00:00,"high cortisol, stress symptoms, cortisol imbalance, adrenal fatigue, stress management, health warnings, wellness"
"Adaptogens 101: Nature's Stress Managers",https://raw.githubusercontent.com/gupta-aayushkr/Pinterest-Gen/master/images/adaptogens-101.png,Health & Longevity,,"Discover the power of adaptogens to help your body manage stress! Herbs like Ashwagandha, Rhodiola, Holy Basil, and Cordyceps can naturally balance your stress hormones, fight fatigue, and boost your resilience. A natural approach to stress relief.",,2026-05-18T17:00:00,"adaptogens, ashwagandha, rhodiola, herbal medicine, natural stress relief, holistic health, wellness herbs"
"The Stress Bucket Model: Why You Feel Overwhelmed",https://raw.githubusercontent.com/gupta-aayushkr/Pinterest-Gen/master/images/stress-bucket-model.png,Health & Longevity,,"Visualizing stress is easier with the Stress Bucket Model. Daily stressors flow into your bucket, and coping mechanisms act as the tap at the bottom. If the tap is closed, your bucket overflows! Learn how to manage your inflow and keep your tap open.",,2026-05-18T18:00:00,"stress bucket, mental health, emotional wellness, coping mechanisms, stress management, burnout prevention, self care"
"4 Vagus Nerve Stimulation Hacks",https://raw.githubusercontent.com/gupta-aayushkr/Pinterest-Gen/master/images/vagus-nerve-hacks.png,Health & Longevity,,"Tap into your body's relaxation superhighway by stimulating the vagus nerve. Simple daily hacks like cold water exposure, humming, deep diaphragmatic breathing, and gargling can significantly reduce stress and promote a calm, balanced nervous system.",,2026-05-18T19:00:00,"vagus nerve, parasympathetic, stress relief hacks, cold exposure, deep breathing, nervous system regulation, holistic health"
