Title,Media URL,Pinterest board,Thumbnail,Description,Link,Publish date,Keywords
"The Hierarchy of Hydration: Beyond Water",https://raw.githubusercontent.com/gupta-aayushkr/Pinterest-Gen/master/images/the-hydration-hierarchy-pyramid-infographic.png,Health & Longevity,,"Why plain water isn't enough. Understand the hierarchy of hydration with minerals and electrolytes.",,2026-04-07T23:30:00,"hydration, electrolytes, water, health hacks, wellness"
"The Breathwork Matrix: CO2 Tolerance & Longevity",https://raw.githubusercontent.com/gupta-aayushkr/Pinterest-Gen/master/images/the-breathwork-matrix-co2-tolerance.png,Health & Longevity,,"A clear matrix for optimal breathing techniques. Discover the longevity benefits of nasal breathing, CO2 tolerance, and box breathing nervous system states.",,2026-04-08T00:30:00,"breathwork, nasal breathing, co2 tolerance, longevity, nervous system, box breathing"
"The Big 4 Nutritional Deficiencies Driving Aging",https://raw.githubusercontent.com/gupta-aayushkr/Pinterest-Gen/master/images/big-4-nutritional-deficiencies-driving-aging.png,Health & Longevity,,"Are you missing critical pillars for health? Discover the 4 most common nutritional deficiencies driving aging: Magnesium, Vitamin D, Omega-3s, and B12.",,2026-04-08T01:30:00,"nutritional deficiencies, anti aging, magnesium benefits, vitamin d, omega 3, longevity"
"Decoding the Glymphatic System: Brain Cleaning",https://raw.githubusercontent.com/gupta-aayushkr/Pinterest-Gen/master/images/decoding-glymphatic-system-brain-cleaning.png,Health & Longevity,,"How your brain cleans itself at night. Deep sleep activates the glymphatic system to flush out toxic buildup and protect cognitive longevity.",,2026-04-08T02:30:00,"glymphatic system, brain health, deep sleep, alzheimers prevention, cognitive longevity, csf flow"
"Fascia: The Hidden Web of Longevity",https://raw.githubusercontent.com/gupta-aayushkr/Pinterest-Gen/master/images/fascia-hidden-web-of-longevity.png,Health & Longevity,,"Discover why keeping your connective tissue hydrated and practicing myofascial release is a secret key to maintaining lifelong mobility and vitality.",,2026-04-08T03:30:00,"fascia health, myofascial release, mobility, connective tissue, longevity, physical therapy"
