Title,Description,Link,Image URL,Board,Publish Date
The Anatomy of a Centenarian's Plate,"A beautifully illustrated guide to the diet of people in Blue Zones, identifying the key plant-based foods for longevity.",https://yoursite.com/centenarian-diet,https://raw.githubusercontent.com/gupta-aayushkr/Pinterest-Gen/master/images/anatomy-of-a-centenarian-plate-blue-zones-longevity-diet.png,Health & Longevity,2026-03-02 08:00
Lifespan vs. Healthspan: Squaring the Curve,"Learn the difference between lifespan and healthspan, and the actionable habits needed to square your curve for prolonged vitality.",https://yoursite.com/healthspan,https://raw.githubusercontent.com/gupta-aayushkr/Pinterest-Gen/master/images/lifespan-vs-healthspan-squaring-the-curve-longevity.png,Health & Longevity,2026-03-03 08:00
The Hierarchy of Longevity Habits,"A simple pyramid showing what foundational daily habits you must prioritize for a long, healthy life before focusing on supplements.",https://yoursite.com/longevity-habits,https://raw.githubusercontent.com/gupta-aayushkr/Pinterest-Gen/master/images/hierarchy-of-longevity-habits-foundation-health.png,Health & Longevity,2026-03-04 08:00
The 24-Hour Cellular Repair Routine,"An ideal daily schedule spanning 24 hours that is optimized to boost your circadian rhythm, longevity, and deep sleep.",https://yoursite.com/repair-routine,https://raw.githubusercontent.com/gupta-aayushkr/Pinterest-Gen/master/images/24-hour-cellular-repair-circadian-rhythm-health-routine.png,Health & Longevity,2026-03-05 08:00
5 Physical Markers of True Biological Age,"Discover 5 physical tests and markers like Grip Strength and VO2 Max that reveal your true biological age instead of your chronological age.",https://yoursite.com/biological-age,https://raw.githubusercontent.com/gupta-aayushkr/Pinterest-Gen/master/images/5-physical-markers-of-true-biological-age-test.png,Health & Longevity,2026-03-06 08:00
