Title,Media URL,Pinterest board,Thumbnail,Description,Link,Publish date,Keywords
"The Science of Cold Thermogenesis","https://raw.githubusercontent.com/gupta-aayushkr/Pinterest-Gen/master/images/cold-thermogenesis.png","Health & Longevity/Longevity","","Explore the longevity benefits of cold exposure, from activating brown fat to reducing inflammation and boosting mood.","","2026-06-13T05:00:00","cold exposure, longevity, cold plunge, biohacking, health"
"Understanding NAD+ & Cellular Aging","https://raw.githubusercontent.com/gupta-aayushkr/Pinterest-Gen/master/images/nad-cellular-aging.png","Health & Longevity/Longevity","","Discover how NAD+ powers cellular energy and DNA repair, and strategies to conquer age-related decline.","","2026-06-13T06:00:00","NAD+, cellular aging, DNA repair, longevity, anti-aging"
"Mouth Taping for Better Sleep","https://raw.githubusercontent.com/gupta-aayushkr/Pinterest-Gen/master/images/mouth-taping-sleep.png","Health & Longevity/Sleep","","Learn how mouth taping promotes nasal breathing to improve sleep quality, boost oxygen uptake, and reduce snoring.","","2026-06-13T07:00:00","mouth taping, sleep optimization, nasal breathing, deep sleep, wellness"
"The Role of Butyrate in Gut Health","https://raw.githubusercontent.com/gupta-aayushkr/Pinterest-Gen/master/images/butyrate-gut-health.png","Health & Longevity/Gut Health","","How butyrate acts as the primary energy source for gut cells, strengthening barrier integrity and immunity.","","2026-06-13T08:00:00","butyrate, gut health, microbiome, immunity, digestion"
"Hormetic Stressors for Longevity","https://raw.githubusercontent.com/gupta-aayushkr/Pinterest-Gen/master/images/hormetic-stressors.png","Health & Longevity/Longevity","","Leverage controlled stress like sauna, cold plunge, and fasting to build resilience and enhance longevity.","","2026-06-13T09:00:00","hormesis, longevity, sauna, fasting, biohacking"
"Intermittent Fasting Windows Explained","https://raw.githubusercontent.com/gupta-aayushkr/Pinterest-Gen/master/images/intermittent-fasting-windows.png","Health & Longevity/Nutrition","","A guide to popular intermittent fasting schedules like 16:8, 18:6, and 20:4 to improve metabolism and autophagy.","","2026-06-13T10:00:00","intermittent fasting, autophagy, metabolism, nutrition, health"
"Grip Strength: A Key to Aging Well","https://raw.githubusercontent.com/gupta-aayushkr/Pinterest-Gen/master/images/grip-strength-aging.png","Health & Longevity/Longevity","","Why grip strength is a vital biomarker for vitality, independence, and long-term survival as you age.","","2026-06-13T11:00:00","grip strength, longevity, aging well, muscle health, vitality"
"Collagen Peptides vs. Bone Broth","https://raw.githubusercontent.com/gupta-aayushkr/Pinterest-Gen/master/images/collagen-vs-bone-broth.png","Health & Longevity/Nutrition","","Comparing the benefits, forms, and nutrients of collagen peptides and bone broth for skin, joint, and gut health.","","2026-06-13T12:00:00","collagen, bone broth, joint health, gut health, nutrition"
"The Truth About Seed Oils","https://raw.githubusercontent.com/gupta-aayushkr/Pinterest-Gen/master/images/seed-oils-truth.png","Health & Longevity/Nutrition","","A balanced perspective on seed oils, common myths, Omega-6 ratios, and how processing affects your health.","","2026-06-13T13:00:00","seed oils, nutrition, inflammation, healthy fats, wellness"
"Menstrual Cycle & Nutrition","https://raw.githubusercontent.com/gupta-aayushkr/Pinterest-Gen/master/images/menstrual-cycle-nutrition.png","Health & Longevity/Nutrition","","How to support your body's hormone levels and energy through the 4 phases of the menstrual cycle using nutrition.","","2026-06-13T14:00:00","menstrual cycle, female health, hormones, nutrition, wellness"
